{
  "$schema": "https://json-schema.org/draft/2020-12/schema",
  "$id": "https://github.com/EarthSciML/isrm.esm/contract/results_schema.json",
  "title": "ISRM cross-language result record",
  "description": "The single result shape every language runner (Julia, Rust, Python) emits after computing the InMAP ISRM tutorial from an isrm*.esm model. Comparing these files is what makes the three runners a cross-language agreement test rather than three independent scripts. Field-by-field tolerances live in compare_results.py, not here.",
  "type": "object",
  "additionalProperties": false,
  "required": ["binding", "model", "mode", "grid", "ppl", "pathways", "total_pm25", "deaths"],
  "properties": {
    "binding": {
      "type": "string",
      "enum": ["julia", "python", "rust"],
      "description": "Which language binding produced this record."
    },
    "binding_version": {
      "type": "string",
      "description": "Version/commit of the EarthSciAST binding used, for provenance."
    },
    "model": {
      "type": "string",
      "description": "Basename of the .esm driven, e.g. \"isrm.esm\". Records from different model files are comparable only if the models are numerically equivalent — isrm.esm, isrm_clean.esm and isrm_pushdown.esm all are."
    },
    "mode": {
      "type": "string",
      "enum": ["runtime_observed_graph", "oracle_step0"],
      "description": "How the numbers were produced. \"runtime_observed_graph\": every value came from the binding's own evaluation of the .esm observed graph — the strict bar. \"oracle_step0\": hand-written STEP-0 arithmetic over the loader outputs, i.e. a reference oracle, NOT a demonstration that the binding executes the spec."
    },
    "grid": {
      "type": "object",
      "additionalProperties": false,
      "required": ["n_src", "n_rcv", "n_rec"],
      "description": "Problem dimensions. Records with differing dimensions are not comparable.",
      "properties": {
        "n_src": {"type": "integer", "description": "Source cells on the SR axis (52411 at full scale)."},
        "n_rcv": {"type": "integer", "description": "Receptor cells (52411 at full scale)."},
        "n_rec": {"type": "integer", "description": "Recognized-pathway EGU FF10 emission records (43650 at full scale)."}
      }
    },
    "ppl": {
      "type": "object",
      "additionalProperties": false,
      "required": ["count", "sha256"],
      "description": "The emission-bearing source-cell support set — the spatial join's output. This is INTEGER-valued, so it MUST be bit-identical across bindings (CONFORMANCE_SPEC §5.5: the distinct member set is byte-identical regardless of candidate-generation backend). Any difference here is a real disagreement, never float noise.",
      "properties": {
        "count": {"type": "integer", "description": "Number of unique emission-bearing source cells (1520 at full scale)."},
        "ids": {
          "type": "array",
          "items": {"type": "integer"},
          "description": "The full sorted 1-based source-cell id list. Optional in the file (it is `count` integers), but when present it is compared elementwise."
        },
        "sha256": {
          "type": "string",
          "pattern": "^[0-9a-f]{64}$",
          "description": "sha256 over the sorted 1-based ids serialized as decimal strings joined by \",\" (ASCII, no spaces, no trailing separator). Language-independent by construction."
        }
      }
    },
    "pathways": {
      "type": "object",
      "description": "Per-pathway intermediates, keyed by SR array name (SOA, pNO3, pNH4, pSO4, PrimaryPM25). Catching a disagreement here localizes it to one pathway instead of only surfacing in the death totals.",
      "additionalProperties": {
        "type": "object",
        "additionalProperties": false,
        "required": ["emis_sum", "conc_sum"],
        "properties": {
          "emis_sum": {"type": "number", "description": "Sum of binned emissions feeding this pathway (tons/yr)."},
          "conc_sum": {"type": "number", "description": "Sum over receptors of this pathway's concentration contribution, BEFORE the fact= 28766.639 scaling."},
          "conc_max": {"type": "number", "description": "Max over receptors of this pathway's concentration contribution."}
        }
      }
    },
    "plume": {
      "type": "object",
      "additionalProperties": false,
      "required": ["sr_lower", "stack_layer", "weights", "pathways"],
      "description": "Plume rise: how each record's mass is split across the SR matrix's three emission layers, and how much mass that puts in each layer. OPTIONAL only because records predating plume rise exist (contract/records/ground-level-only/); every record from a document that states plume rise MUST carry it, and a runner that omits it is not reporting the physics it computed. Everything here comes from the document's own `sr_lower` / `stack_layer` / `w_sr0..2` observeds and its `E_<pathway>_L<layer>` binning aggregates — a runner recomputing any of it would be asserting on its own arithmetic instead of on the spec. NOTE THE SHAPE CHANGE: a record used to be charged to ONE SR layer, and this block carried a per-record `sr_layer` digest. InMAP's sr.Reader.layerFracs splits a record across TWO layers whenever its model layer falls strictly between two entries of `layers` = [0, 3, 6], so a single per-record layer no longer describes the model and `sr_layer` is gone. What replaces it: `sr_lower`, the integer index of the lower of the (at most two) layers, compared EXACTLY the way `ppl` is; `weights`, the three float shares, compared the way every other float in this record is; and `pathways`, the emitted mass per SR layer, which is what the contract really checks. `contract/records/plume_oracle.json` is the independent, SR-free reference all of it is checked against.",
      "properties": {
        "sr_lower": {
          "type": "object",
          "additionalProperties": false,
          "required": ["count", "histogram", "sha256"],
          "description": "The document's `sr_lower` observed, one value per emission record: the LOWER of the (at most two) SR emission layers the record's mass is charged to — the index sr.Reader.layerFracs returns first. 0 for a plume at or below model layer 2, 1 for model layers 3-5, 2 for model layer 6 and above (which folds in InMAP's AboveTopErr clamp). Integer-valued, so it is compared EXACTLY; together with `weights` it reconstructs the whole assignment, because the upper layer, when there is one, is always sr_lower + 1.",
          "properties": {
            "count": {"type": "integer", "description": "Number of records hashed; equals grid.n_rec."},
            "histogram": {
              "type": "array",
              "items": {"type": "integer"},
              "minItems": 3,
              "maxItems": 3,
              "description": "Record counts by lower SR layer 0, 1, 2."
            },
            "sha256": {
              "type": "string",
              "pattern": "^[0-9a-f]{64}$",
              "description": "sha256 over the per-record lower SR layer as ASCII decimals joined by \",\" in RECORD ORDER (int_seq_sha256 in results.py/.jl/contract.rs) — the same wire format as ppl_sha256 but unsorted, because a per-record field is a sequence whose order is part of the value."
            }
          }
        },
        "weights": {
          "type": "object",
          "additionalProperties": false,
          "required": ["count", "max_sum_error", "w_sr0", "w_sr1", "w_sr2"],
          "description": "The document's `w_sr0` / `w_sr1` / `w_sr2` observeds — sr.Reader.layerFracs's per-record fractions, one field of length grid.n_rec each. These are FLOATS, unlike the layer assignment they replace, so they carry the same FieldSummary shape and the same tolerance as every other float field here: `sum`/`min`/`max`/`sample` within RTOL_FIELD, `sha256` informative rather than asserted (the fractions descend from `plume_height`, whose cube roots differ by an ulp between languages, so bit-identity across bindings is not expected). The teeth are elsewhere: `sr_lower` is exact, and `pathways.by_sr_layer` is these weights integrated against emitted mass.",
          "properties": {
            "count": {"type": "integer", "description": "Number of records; equals grid.n_rec."},
            "max_sum_error": {
              "type": "number",
              "description": "max over records of |w_sr0 + w_sr1 + w_sr2 - 1|. layerFracs conserves mass — every record's weights sum to exactly 1 — so this is float noise (~1e-16) or a broken document. Checked against an ABSOLUTE bound, not a relative one."
            },
            "w_sr0": {"$ref": "#/$defs/FieldSummary", "description": "Share of each record's mass charged to SR emission layer 0."},
            "w_sr1": {"$ref": "#/$defs/FieldSummary", "description": "Share of each record's mass charged to SR emission layer 1."},
            "w_sr2": {"$ref": "#/$defs/FieldSummary", "description": "Share of each record's mass charged to SR emission layer 2."}
          }
        },
        "stack_layer": {
          "type": "object",
          "additionalProperties": false,
          "required": ["count", "histogram", "sha256"],
          "description": "The document's `stack_layer` observed: the model layer the STACK TOP sits in, which selects the meteorology plume rise is computed from. Separate from sr_lower because it localizes a disagreement — a wrong stack_layer means the met gather is wrong, a right stack_layer with a wrong SR assignment means the ASME expression or the layerFracs interpolation is.",
          "properties": {
            "count": {"type": "integer"},
            "histogram": {
              "type": "array",
              "items": {"type": "integer"},
              "minItems": 4,
              "description": "Record counts by stack layer over ALL records, so bin 0 includes the zero-height stacks (1100 at full scale, which never enter plume rise). At least four bins: the document's in-bounds argument caps the stack layer at 3 for this inventory, and a fifth bin means that argument no longer holds. [30413, 8460, 3899, 878] at full scale."
            },
            "sha256": {"type": "string", "pattern": "^[0-9a-f]{64}$", "description": "int_seq_sha256 over the per-record stack layer, record order."}
          }
        },
        "pathways": {
          "type": "object",
          "description": "Emitted mass split across the three SR layers, per pathway, keyed by SR array name exactly as the top-level `pathways` block is. This is where the physics becomes visible as mass: at full scale SOx is 0.5/4.3/95.2% across layers 0/1/2, where a ground-level-only document puts 100% in layer 0.",
          "additionalProperties": {
            "type": "object",
            "additionalProperties": false,
            "required": ["by_sr_layer"],
            "properties": {
              "by_sr_layer": {
                "type": "array",
                "items": {"type": "number"},
                "minItems": 3,
                "maxItems": 3,
                "description": "Sum over source cells of E_<pathway>_L0, _L1, _L2 (tons/yr) — the per-record layerFracs weights integrated against emitted mass. Their total is the pathway's `emis_sum` — plume rise moves mass between layers, never into or out of a pathway, and a record split across two layers contributes a share to each."
              }
            }
          }
        }
      }
    },
    "total_pm25": {
      "$ref": "#/$defs/FieldSummary",
      "description": "The fact-scaled total PM2.5 concentration field over receptors."
    },
    "deaths": {
      "type": "object",
      "additionalProperties": false,
      "required": ["krewski", "lepeule"],
      "description": "Attributable-death fields. The tutorial targets are sum(krewski)=7524.918845602511 and sum(lepeule)=16979.632171487083.",
      "properties": {
        "krewski": {"$ref": "#/$defs/FieldSummary", "description": "Krewski relative risk 1.06."},
        "lepeule": {"$ref": "#/$defs/FieldSummary", "description": "Lepeule relative risk 1.14."}
      }
    },
    "timing": {
      "type": "object",
      "additionalProperties": true,
      "description": "Non-comparable provenance: wall-clock, peak RSS, fetched bytes. Recorded for the writeup, never asserted on.",
      "properties": {
        "wall_seconds": {"type": "number"},
        "peak_rss_bytes": {"type": "integer"}
      }
    }
  },
  "$defs": {
    "FieldSummary": {
      "type": "object",
      "additionalProperties": false,
      "required": ["sum", "sample"],
      "description": "Summary of one length-n_rcv float field. `sum` alone is a weak check (cancellation hides per-cell disagreement), so a fixed-index `sample` is required alongside it. `sha256` additionally pins bit-identity where that is expected — across bindings it is NOT expected, since float reduction order differs.",
      "properties": {
        "sum": {"type": "number"},
        "min": {"type": "number"},
        "max": {"type": "number"},
        "sample": {
          "type": "array",
          "items": {"type": "number"},
          "description": "Values at the 25 fixed 1-based indices defined by sample_indices() in compare_results.py: for k=0..24, idx_k = 1 + (k*(n_rcv-1) + 12) div 24, using INTEGER division throughout so the index set cannot drift between languages' float rounding modes. Evenly spans the grid."
        },
        "sha256": {
          "type": "string",
          "pattern": "^[0-9a-f]{64}$",
          "description": "sha256 over the full field as little-endian IEEE-754 float64 bytes. Equal ⇒ bit-identical fields. Unequal ⇒ INCONCLUSIVE, not a failure — compare `sum`/`sample` within tolerance instead. Note -0.0 and +0.0 compare equal as numbers but hash differently, so a field containing zeros can hash differently while being numerically identical."
        }
      }
    }
  }
}
