{
  "binding": "julia",
  "binding_version": "1.12.6",
  "deaths": {
    "krewski": {
      "max": 11.069826902656983,
      "min": 0.0,
      "sample": [
        0.0,
        0.01922897528146272,
        0.0,
        0.004921693775081571,
        0.001344194419004679,
        0.002152990832165204,
        0.009895727063712176,
        0.0075020173317767655,
        0.0786806953227328,
        0.08127337311259752,
        0.3240543568260664,
        0.9052850470962814,
        0.017990816006318047,
        0.5835299925364866,
        1.749576535227847,
        0.08159968225207465,
        0.8491781377088914,
        2.7900544751941534,
        0.782589566104265,
        0.0957985343203953,
        0.0,
        0.031255231823337726,
        0.1220377660516965,
        0.015768499755275223,
        0.0
      ],
      "sha256": "125a62e25b4f612683c950e7ca844c3076a281e873bb775b7fd1700c300faf16",
      "sum": 7524.918845602511
    },
    "lepeule": {
      "max": 25.625317244892972,
      "min": 0.0,
      "sample": [
        0.0,
        0.04326784014667938,
        0.0,
        0.011068580517920269,
        0.0030228122066045453,
        0.004841615179797437,
        0.02225333709952019,
        0.016871602609642076,
        0.17721563993759243,
        0.18349560676735513,
        0.730335874205893,
        2.039398288037547,
        0.04048998098066098,
        1.3143955642869043,
        3.956082190435523,
        0.18371169044233196,
        1.914632388146307,
        6.30821613123122,
        1.7653933217841158,
        0.21602365848323568,
        0.0,
        0.0703331555992143,
        0.2749073605629582,
        0.0354751112178071,
        0.0
      ],
      "sha256": "1e4b6c8d9873ffb84434b1aac84a4ac5d671711965191d22eebdacdfcefa2924",
      "sum": 16979.63217148708
    }
  },
  "grid": {
    "n_rcv": 52411,
    "n_rec": 43650,
    "n_src": 52411
  },
  "mode": "oracle_step0",
  "model": "isrm.esm",
  "pathways": {
    "PrimaryPM25": {
      "conc_max": 0.00028772256697446165,
      "conc_sum": 0.144814141676618,
      "emis_sum": 140822.70985515334
    },
    "SOA": {
      "conc_max": 4.926708012061174e-6,
      "conc_sum": 0.0023490451936843673,
      "emis_sum": 33452.80359612757
    },
    "pNH4": {
      "conc_max": 0.00011612396626660812,
      "conc_sum": 0.03367634914063433,
      "emis_sum": 25012.479214860763
    },
    "pNO3": {
      "conc_max": 0.00012631221745867857,
      "conc_sum": 0.1443780998909014,
      "emis_sum": 1.3144628823038577e6
    },
    "pSO4": {
      "conc_max": 0.00011640211090007412,
      "conc_sum": 0.39155076638125075,
      "emis_sum": 1.5712168812541938e6
    }
  },
  "ppl": {
    "count": 1520,
    "ids": [
      842,
      1635,
      1686,
      1754,
      1968,
      2089,
      2256,
      2405,
      2407,
      2431,
      2486,
      2538,
      2540,
      2799,
      2941,
      2959,
      3078,
      3138,
      3167,
      3170,
      3187,
      3280,
      3281,
      3282,
      3324,
      3343,
      3350,
      3351,
      3376,
      3451,
      3502,
      3512,
      3551,
      3553,
      3554,
      3555,
      3574,
      3597,
      3638,
      3685,
      3857,
      3858,
      3859,
      3905,
      3931,
      3938,
      3985,
      4000,
      4003,
      4060,
      4061,
      4153,
      4172,
      4221,
      4228,
      4236,
      4237,
      4241,
      4242,
      4340,
      4444,
      4551,
      4554,
      4556,
      4558,
      4615,
      4620,
      4701,
      4754,
      4800,
      4840,
      4868,
      4885,
      4886,
      4898,
      4998,
      5003,
      5143,
      5144,
      5252,
      5320,
      5330,
      5335,
      5407,
      5468,
      5480,
      5492,
      5496,
      5555,
      5638,
      5737,
      5746,
      5747,
      5953,
      5973,
      6020,
      6600,
      6721,
      6766,
      6767,
      6774,
      6849,
      7262,
      7518,
      7959,
      8357,
      8680,
      8952,
      8990,
      9140,
      9153,
      9334,
      9351,
      10059,
      10438,
      10489,
      10634,
      10655,
      10681,
      10691,
      10954,
      11014,
      11015,
      11120,
      11197,
      11389,
      11414,
      11522,
      11539,
      11594,
      11677,
      11726,
      11749,
      11790,
      11791,
      11858,
      11921,
      11936,
      11974,
      12097,
      12103,
      12116,
      12503,
      12571,
      12572,
      12613,
      12627,
      12650,
      12651,
      12656,
      12657,
      12664,
      12712,
      12715,
      12742,
      12798,
      12860,
      12929,
      12930,
      12933,
      12936,
      12971,
      13008,
      13009,
      13010,
      13067,
      13249,
      13291,
      13292,
      13568,
      13602,
      13659,
      13858,
      13876,
      13938,
      13995,
      14008,
      14121,
      14232,
      14239,
      14277,
      14323,
      14377,
      14395,
      14416,
      14467,
      14481,
      14525,
      14545,
      14599,
      14605,
      14606,
      14626,
      14681,
      14770,
      14771,
      14849,
      14850,
      14862,
      14867,
      14937,
      15033,
      15044,
      15052,
      15094,
      15100,
      15143,
      15148,
      15155,
      15191,
      15240,
      15283,
      15308,
      15395,
      15450,
      15504,
      15582,
      15584,
      15609,
      15611,
      15732,
      15734,
      15746,
      15844,
      15954,
      15955,
      15996,
      16019,
      16078,
      16086,
      16126,
      16284,
      16294,
      16433,
      16435,
      16443,
      16596,
      16597,
      16627,
      16655,
      16658,
      16665,
      16676,
      16678,
      16680,
      16734,
      16736,
      16742,
      16780,
      16782,
      16785,
      16813,
      16818,
      16846,
      16896,
      16913,
      16915,
      16917,
      16932,
      16933,
      16956,
      16962,
      17005,
      17014,
      17035,
      17061,
      17063,
      17128,
      17140,
      17144,
      17189,
      17206,
      17222,
      17255,
      17262,
      17263,
      17273,
      17344,
      17357,
      17361,
      17365,
      17379,
      17421,
      17463,
      17470,
      17471,
      17485,
      17512,
      17565,
      17573,
      17634,
      17702,
      17713,
      17719,
      17725,
      17727,
      17728,
      17729,
      17730,
      17731,
      17799,
      17807,
      17817,
      17818,
      17819,
      17822,
      17825,
      17827,
      17895,
      17913,
      17974,
      18003,
      18045,
      18076,
      18078,
      18131,
      18134,
      18135,
      18141,
      18146,
      18147,
      18160,
      18202,
      18203,
      18216,
      18229,
      18240,
      18280,
      18283,
      18290,
      18291,
      18369,
      18406,
      18411,
      18417,
      18421,
      18422,
      18427,
      18434,
      18471,
      18621,
      18636,
      18640,
      18650,
      18663,
      18669,
      18670,
      18671,
      18672,
      18684,
      18788,
      18794,
      18824,
      18828,
      18947,
      18954,
      18963,
      18966,
      19056,
      19060,
      19062,
      19140,
      19145,
      19150,
      19151,
      19154,
      19155,
      19166,
      19205,
      19295,
      19308,
      19309,
      19313,
      19316,
      19348,
      19419,
      19436,
      19631,
      19758,
      19928,
      20080,
      20083,
      20085,
      20086,
      20093,
      20094,
      20099,
      20100,
      20101,
      20102,
      20104,
      20106,
      20249,
      20342,
      20345,
      20351,
      20356,
      20357,
      20388,
      20412,
      20448,
      20464,
      20480,
      20539,
      20541,
      20542,
      20543,
      20547,
      20551,
      20553,
      20556,
      20557,
      20559,
      20568,
      20641,
      20642,
      20647,
      20674,
      20695,
      20702,
      20704,
      20711,
      20774,
      20778,
      20791,
      20794,
      20824,
      20851,
      20854,
      20856,
      20860,
      20861,
      20862,
      20866,
      20867,
      20871,
      20874,
      20876,
      20958,
      20971,
      20976,
      21067,
      21083,
      21163,
      21358,
      21360,
      21450,
      21478,
      21481,
      21488,
      21559,
      21664,
      21666,
      21674,
      21677,
      21682,
      21683,
      21732,
      21785,
      21796,
      21830,
      21846,
      21855,
      21862,
      21863,
      21877,
      21878,
      21913,
      21914,
      21915,
      21930,
      21945,
      21947,
      21959,
      21984,
      21985,
      22003,
      22015,
      22022,
      22032,
      22048,
      22050,
      22054,
      22063,
      22064,
      22072,
      22074,
      22141,
      22187,
      22192,
      22193,
      22197,
      22257,
      22263,
      22264,
      22265,
      22271,
      22298,
      22299,
      22300,
      22306,
      22310,
      22321,
      22330,
      22340,
      22348,
      22361,
      22379,
      22390,
      22392,
      22394,
      22403,
      22404,
      22460,
      22470,
      22472,
      22482,
      22551,
      22558,
      22572,
      22577,
      22587,
      22590,
      22604,
      22607,
      22624,
      22647,
      22650,
      22666,
      22672,
      22688,
      22692,
      22790,
      22795,
      22816,
      22819,
      22824,
      22831,
      22879,
      22914,
      22919,
      22939,
      22973,
      22974,
      23000,
      23003,
      23073,
      23078,
      23083,
      23087,
      23088,
      23089,
      23095,
      23096,
      23099,
      23148,
      23152,
      23177,
      23178,
      23191,
      23195,
      23220,
      23227,
      23245,
      23246,
      23254,
      23266,
      23267,
      23269,
      23314,